{
  "acoustid": "9b44b477-2314-4d47-94dd-507e488c04ac",
  "duration_ms": 4011830,
  "schema_version": 1,
  "markers": [
    {
      "kind": "skip/intro_speech",
      "start_ms": 0,
      "end_ms": 103960,
      "source": "plugin:speech-music-marker"
    },
    {
      "kind": "skip/trail_silence",
      "start_ms": 4007139,
      "end_ms": 4011830,
      "source": "plugin:silence-marker"
    }
  ]
}
