{
  "acoustid": "6ada2e99-9ca0-4b44-8703-83e75454fca0",
  "duration_ms": 1912950,
  "schema_version": 1,
  "markers": [
    {
      "kind": "skip/intro_speech",
      "start_ms": 0,
      "end_ms": 100320,
      "source": "plugin:speech-music-marker"
    },
    {
      "kind": "skip/outro_speech",
      "start_ms": 1821452,
      "end_ms": 1912950,
      "source": "plugin:speech-music-marker"
    },
    {
      "kind": "skip/trail_silence",
      "start_ms": 1911858,
      "end_ms": 1912950,
      "source": "plugin:silence-marker"
    }
  ]
}
