{
  "acoustid": "b3c5d607-384a-47b4-b43b-484168b0bae8",
  "duration_ms": 4103500,
  "schema_version": 1,
  "markers": [
    {
      "kind": "skip/intro_speech",
      "start_ms": 0,
      "end_ms": 114000,
      "source": "plugin:speech-music-marker"
    },
    {
      "kind": "skip/lead_silence",
      "start_ms": 0,
      "end_ms": 907,
      "source": "plugin:silence-marker"
    },
    {
      "kind": "skip/trail_silence",
      "start_ms": 4072981,
      "end_ms": 4103490,
      "source": "plugin:silence-marker"
    }
  ]
}
