{
  "acoustid": "2df54ca5-f0cf-4bde-a8fd-690c751da3ed",
  "duration_ms": 3930310,
  "schema_version": 1,
  "markers": [
    {
      "kind": "skip/intro_speech",
      "start_ms": 0,
      "end_ms": 83900,
      "source": "plugin:speech-music-marker"
    },
    {
      "kind": "skip/outro_speech",
      "start_ms": 3671333,
      "end_ms": 3930310,
      "source": "plugin:speech-music-marker"
    },
    {
      "kind": "skip/trail_silence",
      "start_ms": 3929229,
      "end_ms": 3930310,
      "source": "plugin:silence-marker"
    }
  ]
}
