{
  "acoustid": "d426439a-3be7-46d1-9bd3-1b79ccc19db8",
  "duration_ms": 3996090,
  "schema_version": 1,
  "markers": [
    {
      "kind": "skip/intro_speech",
      "start_ms": 0,
      "end_ms": 124000,
      "source": "plugin:speech-music-marker"
    },
    {
      "kind": "skip/trail_silence",
      "start_ms": 3978901,
      "end_ms": 3996090,
      "source": "plugin:silence-marker"
    }
  ]
}
