{
  "acoustid": "536d646a-8a15-4df0-9d4c-614a5fd9c597",
  "duration_ms": 4040230,
  "schema_version": 1,
  "markers": [
    {
      "kind": "skip/intro_speech",
      "start_ms": 0,
      "end_ms": 113920,
      "source": "plugin:speech-music-marker"
    },
    {
      "kind": "skip/trail_silence",
      "start_ms": 4029961,
      "end_ms": 4040230,
      "source": "plugin:silence-marker"
    }
  ]
}
