{
  "acoustid": "c3fe6eea-b3c1-4362-bb68-3981427ce7ed",
  "duration_ms": 3724210,
  "schema_version": 1,
  "markers": [
    {
      "kind": "skip/intro_speech",
      "start_ms": 0,
      "end_ms": 112380,
      "source": "plugin:speech-music-marker"
    },
    {
      "kind": "skip/trail_silence",
      "start_ms": 3706743,
      "end_ms": 3724210,
      "source": "plugin:silence-marker"
    }
  ]
}
