{
  "acoustid": "8a68edd0-61c3-43c9-8143-07c9d66b1b22",
  "duration_ms": 1961980,
  "schema_version": 1,
  "markers": [
    {
      "kind": "skip/intro_speech",
      "start_ms": 0,
      "end_ms": 122060,
      "source": "plugin:speech-music-marker"
    },
    {
      "kind": "skip/trail_silence",
      "start_ms": 1951891,
      "end_ms": 1961980,
      "source": "plugin:silence-marker"
    }
  ]
}
