{
  "acoustid": "ae3d72d1-fd55-48a5-aaa7-3360d8cf0977",
  "duration_ms": 1344790,
  "schema_version": 1,
  "markers": [
    {
      "kind": "skip/intro_speech",
      "start_ms": 0,
      "end_ms": 125580,
      "source": "plugin:speech-music-marker"
    },
    {
      "kind": "skip/outro_speech",
      "start_ms": 1202387,
      "end_ms": 1344780,
      "source": "plugin:speech-music-marker"
    },
    {
      "kind": "skip/trail_silence",
      "start_ms": 1342767,
      "end_ms": 1344780,
      "source": "plugin:silence-marker"
    }
  ]
}
