{
  "acoustid": "5f511dfd-5c26-476e-a82d-84c83bba5682",
  "duration_ms": 4023140,
  "schema_version": 1,
  "markers": [
    {
      "kind": "skip/intro_speech",
      "start_ms": 0,
      "end_ms": 148260,
      "source": "plugin:speech-music-marker"
    },
    {
      "kind": "skip/outro_speech",
      "start_ms": 3877596,
      "end_ms": 4023130,
      "source": "plugin:speech-music-marker"
    },
    {
      "kind": "skip/trail_silence",
      "start_ms": 4011488,
      "end_ms": 4023130,
      "source": "plugin:silence-marker"
    }
  ]
}
