{
  "acoustid": "5db2be09-f0eb-4433-aac4-1ec9072067f8",
  "duration_ms": 2190050,
  "schema_version": 1,
  "markers": [
    {
      "kind": "skip/intro_speech",
      "start_ms": 0,
      "end_ms": 117020,
      "source": "plugin:speech-music-marker"
    },
    {
      "kind": "skip/trail_silence",
      "start_ms": 2168235,
      "end_ms": 2190050,
      "source": "plugin:silence-marker"
    }
  ]
}
