{
  "acoustid": "49d819f2-f1ea-4546-9361-f3f9aa7dad49",
  "duration_ms": 2288750,
  "schema_version": 1,
  "markers": [
    {
      "kind": "skip/intro_speech",
      "start_ms": 0,
      "end_ms": 133280,
      "source": "plugin:speech-music-marker"
    },
    {
      "kind": "skip/trail_silence",
      "start_ms": 2279025,
      "end_ms": 2288740,
      "source": "plugin:silence-marker"
    }
  ]
}
