{
  "acoustid": "3a54ac2b-48a3-4329-be9b-68bc6d4093e2",
  "duration_ms": 3811120,
  "schema_version": 1,
  "markers": [
    {
      "kind": "skip/intro_speech",
      "start_ms": 0,
      "end_ms": 130400,
      "source": "plugin:speech-music-marker"
    },
    {
      "kind": "skip/outro_speech",
      "start_ms": 3753097,
      "end_ms": 3811110,
      "source": "plugin:speech-music-marker"
    }
  ]
}
