{
  "acoustid": "f35dee02-f7ea-40f5-86b7-b870fe830e02",
  "duration_ms": 2656820,
  "schema_version": 1,
  "markers": [
    {
      "kind": "skip/intro_speech",
      "start_ms": 0,
      "end_ms": 114880,
      "source": "plugin:speech-music-marker"
    },
    {
      "kind": "skip/lead_silence",
      "start_ms": 0,
      "end_ms": 907,
      "source": "plugin:silence-marker"
    },
    {
      "kind": "skip/outro_speech",
      "start_ms": 2656071,
      "end_ms": 2656820,
      "source": "plugin:speech-music-marker"
    }
  ]
}
