{
  "acoustid": "64c99e51-2dbb-4396-a0a3-1232bbd36c13",
  "duration_ms": 4273040,
  "schema_version": 1,
  "markers": [
    {
      "kind": "skip/intro_speech",
      "start_ms": 0,
      "end_ms": 94260,
      "source": "plugin:speech-music-marker"
    },
    {
      "kind": "skip/outro_speech",
      "start_ms": 4220760,
      "end_ms": 4273030,
      "source": "plugin:speech-music-marker"
    },
    {
      "kind": "skip/trail_silence",
      "start_ms": 4271824,
      "end_ms": 4273030,
      "source": "plugin:silence-marker"
    }
  ]
}
