{
  "acoustid": "9f12801f-a43d-45f6-8cc4-30c1b63fe53d",
  "duration_ms": 3441850,
  "schema_version": 1,
  "markers": [
    {
      "kind": "skip/intro_speech",
      "start_ms": 0,
      "end_ms": 82880,
      "source": "plugin:speech-music-marker"
    },
    {
      "kind": "skip/outro_speech",
      "start_ms": 3355830,
      "end_ms": 3441840,
      "source": "plugin:speech-music-marker"
    },
    {
      "kind": "skip/trail_silence",
      "start_ms": 3440586,
      "end_ms": 3441840,
      "source": "plugin:silence-marker"
    }
  ]
}
