{
  "acoustid": "dbd068fa-60be-4a39-858c-f798f1486455",
  "duration_ms": 4089560,
  "schema_version": 1,
  "markers": [
    {
      "kind": "skip/intro_speech",
      "start_ms": 0,
      "end_ms": 121760,
      "source": "plugin:speech-music-marker"
    },
    {
      "kind": "skip/trail_silence",
      "start_ms": 4079562,
      "end_ms": 4089560,
      "source": "plugin:silence-marker"
    }
  ]
}
